[
  {
    "customer_id": "550e8400-e29b-41d4-a716-446655440001",
    "source_customer_id": "CRM-001",
    "email_hash": "a665a45920422f9d417e4867efdc4fb8a04a1f3fff1fa07e998e86f7f7a27ae3",
    "first_name": "Alice",
    "last_name": "Chen",
    "country_code": "US",
    "city": "San Francisco",
    "signup_date": "2022-03-15",
    "customer_segment": "GOLD",
    "loyalty_points": 4500,
    "is_active": true,
    "created_at": "2022-03-15T10:30:00Z",
    "updated_at": "2024-01-10T08:00:00Z",
    "_schema_version": "1.0"
  },
  {
    "customer_id": "550e8400-e29b-41d4-a716-446655440002",
    "source_customer_id": "CRM-002",
    "email_hash": "b14a7b8059d9c055954c92674ce60032d1e4a6e5f6e56d2b7e7a38f2b9f3a1d",
    "first_name": "Bob",
    "last_name": "Martinez",
    "country_code": "GB",
    "city": "London",
    "signup_date": "2021-07-22",
    "customer_segment": "PLATINUM",
    "loyalty_points": 12300,
    "is_active": true,
    "created_at": "2021-07-22T14:00:00Z",
    "updated_at": "2024-01-12T09:30:00Z",
    "_schema_version": "1.0"
  },
  {
    "customer_id": "550e8400-e29b-41d4-a716-446655440003",
    "source_customer_id": "CRM-003",
    "email_hash": "c3d4e5f6a7b8c9d0e1f2a3b4c5d6e7f8a9b0c1d2e3f4a5b6c7d8e9f0a1b2c3d",
    "first_name": "Carol",
    "last_name": "Zhang",
    "country_code": "DE",
    "city": null,
    "signup_date": "2023-11-01",
    "customer_segment": "BRONZE",
    "loyalty_points": 150,
    "is_active": false,
    "created_at": "2023-11-01T07:45:00Z",
    "updated_at": "2023-12-15T11:00:00Z",
    "_schema_version": "1.0"
  }
]
